{
  "schema_version": "camera-trajectory/v1",
  "game_id": "kcd2",
  "scene_id": "example_field",
  "trajectory_id": "relative_motion_example",
  "coordinate_system": {
    "handedness": "unknown",
    "vertical_axis": "z",
    "angle_unit": "degrees",
    "position_unit": "game_units"
  },
  "keyframes": [
    {
      "index": 0,
      "time_sec": 0.0,
      "pose": {
        "position": {"x": 0.0, "y": 0.0, "z": 1.8},
        "rotation": {"yaw": 0.0, "pitch": 0.0, "roll": 0.0},
        "fov_degrees": 63.0
      }
    },
    {
      "index": 1,
      "time_sec": 1.0,
      "pose": {
        "position": {"x": 3.0, "y": 1.0, "z": 2.0},
        "rotation": {"yaw": 8.0, "pitch": -1.0, "roll": 0.0},
        "fov_degrees": 62.0
      }
    }
  ],
  "metadata": {
    "control_note": "Format example only; exact absolute setPose is not claimed for KCD2."
  }
}
